Source,Original_Platform,Title,URL,SelfText_Length_Chars,Score,Comments,Published_At,Is_Link_Post
Reddit (r/LocalLLaMA),Reddit,Someone who's using Qwen 3.5 on real code bases how good is it?,https://www.reddit.com/r/LocalLLaMA/comments/1s9hqxa/someone_whos_using_qwen_35_on_real_code_bases_how/,232,19,31,2026-04-01 11:24:01,False
Reddit (r/LocalLLaMA),Reddit,Hcompany/Holo3-35B-A3B • Huggingface,https://www.reddit.com/r/LocalLLaMA/comments/1s946dn/hcompanyholo335ba3b_huggingface/,494,13,5,2026-03-31 23:45:45,False
Reddit (r/LocalLLaMA),Reddit,Training mRNA Language Models Across 25 Species for $165,https://huggingface.co/blog/OpenMed/training-mrna-models-25-species,580,13,0,2026-03-31 21:41:13,True
Reddit (r/LocalLLaMA),Reddit,"made an LLM calculator, if anyone's interested",https://i.redd.it/gpkcqr1dkjsg1.png,125,10,6,2026-04-01 08:47:32,True
Reddit (r/LocalLLaMA),Reddit,So crazy for a 350m param model,https://www.reddit.com/r/LocalLLaMA/comments/1s9hw2e/so_crazy_for_a_350m_param_model/,501,8,1,2026-04-01 11:31:01,False
Reddit (r/LocalLLaMA),Reddit,Qwen 3.5 9B LLM GGUF quantized for local structured extraction,https://www.reddit.com/r/LocalLLaMA/comments/1s9mzrl/qwen_35_9b_llm_gguf_quantized_for_local/,1380,8,1,2026-04-01 14:59:58,False
Reddit (r/LocalLLaMA),Reddit,Sebastian Raschka's article on Claude Code architecture,https://x.com/i/status/2038980345316413862,0,8,1,2026-04-01 09:38:40,True
Reddit (r/LocalLLaMA),Reddit,Pure C implementation of the TurboQuant paper (ICLR 2026) for KV cache compression in LLM inference.,https://www.reddit.com/r/LocalLLaMA/comments/1s9eqy2/pure_c_implementation_of_the_turboquant_paper/,611,8,0,2026-04-01 08:37:24,False
Reddit (r/LocalLLaMA),Reddit,Yo-GPT - a model you can run locally to replicate the iconic app,https://www.reddit.com/r/LocalLLaMA/comments/1s9gds2/yogpt_a_model_you_can_run_locally_to_replicate/,587,6,3,2026-04-01 10:11:39,False
Reddit (r/LocalLLaMA),Reddit,Turboquant on llama.cpp for Metal using Rust,https://github.com/joshuagamboa/turboquant-apple-silicon,306,6,1,2026-04-01 08:23:09,True
Reddit (r/LocalLLaMA),Reddit,What are the best uncensored / unrestricted AI models right now? Is Qwen3.5 (HauhauCS) the best?,https://www.reddit.com/r/LocalLLaMA/comments/1s9t3ud/what_are_the_best_uncensored_unrestricted_ai/,474,5,19,2026-04-01 18:32:10,False
Reddit (r/LocalLLaMA),Reddit,Has anyone tested the quantization quality (AWQ/GPTQ/FP8/NVFP4) for Qwen3.5 9B &amp; 27B on vLLM?,https://www.reddit.com/r/LocalLLaMA/comments/1s9iyrw/has_anyone_tested_the_quantization_quality/,264,5,14,2026-04-01 12:21:11,False
Reddit (r/LocalLLaMA),Reddit,Experts-Volunteers needed for LongCat models - llama.cpp,https://www.reddit.com/r/LocalLLaMA/comments/1s9im08/expertsvolunteers_needed_for_longcat_models/,1417,5,0,2026-04-01 12:05:08,False
Reddit (r/LocalLLaMA),Reddit,The third party effect: source framing to reduce sycophantic engagement,https://www.reddit.com/gallery/1s9sh9a,3463,4,0,2026-04-01 18:11:36,True
Reddit (r/LocalLLaMA),Reddit,"Im guessing its an LM Studio update, but after update, tokens per second no longer shows under messages?",https://www.reddit.com/r/LocalLLaMA/comments/1s9efuu/im_guessing_its_an_lm_studio_update_but_after/,215,4,5,2026-04-01 08:18:12,False
Reddit (r/LocalLLaMA),Reddit,Made a ExllamaV3 quant fork of vibevoice.,https://www.reddit.com/r/LocalLLaMA/comments/1s9dhm4/made_a_exllamav3_quant_fork_of_vibevoice/,287,4,1,2026-04-01 07:19:59,False
Reddit (r/LocalLLaMA),Reddit,Local LLM inference on M4 Max vs M5 Max,https://www.reddit.com/r/LocalLLaMA/comments/1s97chj/local_llm_inference_on_m4_max_vs_m5_max/,1825,4,1,2026-04-01 02:04:04,False
Reddit (r/LocalLLaMA),Reddit,"I want to built a simple agent with some memory and basic skills, where should I start?",https://www.reddit.com/r/LocalLLaMA/comments/1s95mdj/i_want_to_built_a_simple_agent_with_some_memory/,91,4,13,2026-04-01 00:48:03,False
Reddit (r/LocalLLaMA),Reddit,Recommended models for local agentic SWE like opencode with 48vgb 128gb ram,https://www.reddit.com/r/LocalLLaMA/comments/1s940yb/recommended_models_for_local_agentic_swe_like/,883,4,8,2026-03-31 23:39:35,False
Reddit (r/LocalLLaMA),Reddit,IBM and Apache 2? Who Would Have Thought - Granite 4 3B Vision,https://www.reddit.com/r/LocalLLaMA/comments/1s8z2pv/ibm_and_apache_2_who_would_have_thought_granite_4/,1423,3,3,2026-03-31 20:26:41,False
Reddit (r/LocalLLaMA),Reddit,What hardware to buy if I want to run a 70 B model locally?,https://www.reddit.com/r/LocalLLaMA/comments/1s9se9f/what_hardware_to_buy_if_i_want_to_run_a_70_b/,589,3,15,2026-04-01 18:08:48,False
Reddit (r/LocalLLaMA),Reddit,Is the DGX Spark worth the money?,https://www.reddit.com/gallery/1s9qyum,2909,3,23,2026-04-01 17:19:38,True
Reddit (r/LocalLLaMA),Reddit,Anyone using LLMs for reviewing documents (feedback/fact-checking/sanity-checking): Do you have any advice?,https://www.reddit.com/r/LocalLLaMA/comments/1s9nk6b/anyone_using_llms_for_reviewing_documents/,933,3,2,2026-04-01 15:19:54,False
Reddit (r/LocalLLaMA),Reddit,"I wrote a from-scratch quantization lesson covering FP8, GPTQ, AWQ, and GGUF with actual implementations you can run",https://www.reddit.com/r/LocalLLaMA/comments/1s9g89h/i_wrote_a_fromscratch_quantization_lesson/,2021,4,2,2026-04-01 10:03:14,False
Reddit (r/LocalLLaMA),Reddit,Will 48 vs 64 GB of ram in a new mbp make a big difference?,https://www.reddit.com/r/LocalLLaMA/comments/1s99ctu/will_48_vs_64_gb_of_ram_in_a_new_mbp_make_a_big/,335,3,30,2026-04-01 03:35:11,False
Reddit (r/LocalLLaMA),Reddit,Will Google TurboQuant help people with low end hardware?,https://www.reddit.com/r/LocalLLaMA/comments/1s93c75/will_google_turboquant_help_people_with_low_end/,147,3,16,2026-03-31 23:11:28,False
Reddit (r/programming),Reddit,Announcement: Temporary LLM Content Ban,https://www.reddit.com/r/programming/comments/1s9jkzi/announcement_temporary_llm_content_ban/,1045,1168,130,2026-04-01 12:48:20,False
Reddit (r/programming),Reddit,"""Why does this code look like this?"" Nobody knows. That's the problem.",https://maintainable.fm/episodes/russ-olsen-the-hidden-cost-of-forgetting-why-the-code-looks-like-that-uozj8sOU,661,165,50,2026-03-31 22:28:22,True
Reddit (r/programming),Reddit,What's cch? Reverse Engineering Claude Code's Request Signing,https://a10k.co/b/reverse-engineering-claude-code-cch.html,258,22,8,2026-04-01 03:14:08,True
Reddit (r/programming),Reddit,Breaking Enigma with Index of Coincidence on a Commodore 64,https://imapenguin.com/2026/03/breaking-enigma-with-index-of-coincidence-on-a-commodore-64/,0,14,2,2026-03-31 21:52:12,True
Reddit (r/programming),Reddit,Wrapping my head around Tail Recursion and TCO,https://functiondispatch.substack.com/p/understanding-tail-recursion-and-tco,0,11,0,2026-04-01 12:26:03,True
Reddit (r/programming),Reddit,Understanding CPUs by building one in Kotlin,https://bloder.io/cpu-from-scratch-part-1,731,4,0,2026-04-01 17:21:29,True
Reddit (r/programming),Reddit,Throttling can silently drop the final state of an interaction,https://blog.gaborkoos.com/posts/2026-03-31-Your-Throttling-Is-Lying-to-You/,62,4,1,2026-04-01 13:00:17,True
Reddit (r/programming),Reddit,Timesliced reservoir sampling: a new(?) algorithm for profilers,https://pythonspeed.com/articles/reservoir-sampling-profilers/,0,2,0,2026-04-01 16:27:40,True
Reddit (r/programming),Reddit,The journey of a request in a Raft-based KV store (from client to commit),https://abdellani.dev/posts/2026-04-01-the-journey-of-a-request-in-a-raft-based-kv-store/,701,2,0,2026-04-01 12:50:55,True
Reddit (r/programming),Reddit,Simple Top-Down Parsing in Python,https://web.archive.org/web/20150228044653/http://effbot.org/zone/simple-top-down-parsing.htm,0,1,1,2026-04-01 15:20:28,True
Reddit (r/programming),Reddit,The API is the Platform • Shamasis Bhattacharya,https://youtu.be/70hmVqBO1gI?list=PLEx5khR4g7PJy5LslEV6EbSEhmw-88ezL,0,1,0,2026-04-01 12:15:20,True
Reddit (r/programming),Reddit,Solved distributed GraphQL N+1 Query Problem Annotation Driven,https://www.youtube.com/watch?v=Hq8Q60PFd3Y,26,1,0,2026-04-01 11:57:41,True
Reddit (r/programming),Reddit,Deterministic(ish) machine configuration with Python,https://matt.si/2026-04/dotfiles/,0,1,0,2026-04-01 11:52:46,True
Reddit (r/programming),Reddit,You can't scale when you're dead [TigerBeetle video],https://www.youtube.com/watch?v=iWGB7b4ZvtU,382,0,0,2026-04-01 15:45:10,True
Reddit (r/programming),Reddit,Making Services With Go Right Way,https://snawoot.github.io/go_web_right_way.html,0,0,4,2026-03-31 22:56:55,True
Reddit (r/programming),Reddit,How to implement Server-Sent Events in Go,https://youtu.be/nvijc5J-JAQ,0,0,0,2026-03-31 19:41:03,True
Reddit (r/programming),Reddit,I Rebuilt Traceroute in Rust and It Was Simpler Than I Expected,https://tech.stonecharioteer.com/posts/2026/traceroute/,0,0,6,2026-04-01 17:13:24,True
Reddit (r/programming),Reddit,"I switched to OOP, it's better!",https://www.youtube.com/watch?v=p0ibKUGR2bg,0,0,5,2026-04-01 17:01:10,True
Reddit (r/programming),Reddit,"The pain of microservices can be avoided, but not with traditional databases",https://blog.redplanetlabs.com/2026/03/31/the-pain-of-microservices-can-be-avoided-but-not-with-traditional-databases/,0,0,2,2026-04-01 18:05:07,True
Hacker News,Hacker News,EmDash – a spiritual successor to WordPress that solves plugin security,https://blog.cloudflare.com/emdash-wordpress/,0,266,163,2026-04-01 16:14:38,True
Hacker News,Hacker News,Ask HN: Who is hiring? (April 2026),https://news.ycombinator.com/item?id=47601859,1386,123,97,2026-04-01 15:01:36,False
Hacker News,Hacker News,TurboQuant KV Compression and SSD Expert Streaming for M5 Pro and IOS,https://github.com/SharpAI/SwiftLM,0,27,6,2026-04-01 18:06:00,True
Hacker News,Hacker News,StepFun 3.5 Flash is #1 cost-effective model for OpenClaw tasks (300 battles),https://app.uniclaw.ai/arena?tab=costEffectiveness&via=hn,0,85,30,2026-04-01 16:17:35,True
Hacker News,Hacker News,AI for American-produced cement and concrete,https://engineering.fb.com/2026/03/30/data-center-engineering/ai-for-american-produced-cement-and-concrete/,0,63,55,2026-04-01 17:17:24,True
Hacker News,Hacker News,NASA Artemis II moon mission live launch broadcast,https://plus.nasa.gov/scheduled-video/nasas-artemis-ii-crew-launches-to-the-moon-official-broadcast/,0,165,79,2026-04-01 17:11:31,True
Hacker News,Hacker News,An Introduction to Writing Systems and Unicode,https://r12a.github.io/scripts/tutorial/part2,0,17,5,2026-03-29 17:43:52,True
Hacker News,Hacker News,CERN levels up with new superconducting karts,https://home.cern/news/news/engineering/cern-levels-new-superconducting-karts,0,345,79,2026-04-01 07:27:13,True
Hacker News,Hacker News,The OpenAI Graveyard: All the Deals and Products That Haven't Happened,https://www.forbes.com/sites/phoebeliu/2026/03/31/openai-graveyard-deals-and-products-havent-happened-openai/,0,140,98,2026-04-01 15:55:30,True
Hacker News,Hacker News,"Show HN: Zerobox – Sandbox any command with file, network, credential controls",https://github.com/afshinm/zerobox,2178,40,40,2026-03-30 14:32:36,True
Hacker News,Hacker News,Show HN: Real-time dashboard for Claude Code agent teams,https://github.com/simple10/agents-observe,1357,48,17,2026-04-01 16:24:28,True
Hacker News,Hacker News,Show HN: Git bayesect – Bayesian Git bisection for non-deterministic bugs,https://github.com/hauntsaninja/git_bayesect,0,11,3,2026-03-28 20:32:01,True
Hacker News,Hacker News,Is BGP safe yet?,https://isbgpsafeyet.com/,0,196,69,2026-04-01 13:10:29,True
Hacker News,Hacker News,The AI Marketing BS Index,https://bastian.rieck.me/blog/2026/bs/,0,35,3,2026-04-01 17:55:12,True
Hacker News,Hacker News,"Random numbers, Persian code: A mysterious signal transfixes radio sleuths",https://www.rferl.org/a/mystery-numbers-station-persian-signal-iran-war/33700659.html,232,77,82,2026-04-01 11:39:04,True
Hacker News,Hacker News,Ukrainian Drone Holds Position for 6 Weeks,https://defenceleaders.com/news/ukrainian-combat-robot-holds-frontline-position-for-six-weeks-in-sign-of-growing-ugv-maturity/,0,47,14,2026-04-01 17:57:40,True
Hacker News,Hacker News,Ada and Spark on ARM Cortex-M – A Tutorial with Arduino and Nucleo Examples,http://inspirel.com/articles/Ada_On_Cortex.html,0,38,8,2026-03-28 06:26:42,True
Hacker News,Hacker News,Consider the Greenland Shark (2020),https://www.lrb.co.uk/the-paper/v42/n09/katherine-rundell/consider-the-greenland-shark,0,69,28,2026-03-27 07:39:40,True
Hacker News,Hacker News,Intuiting Pratt Parsing,https://louis.co.nz/2026/03/26/pratt-parsing.html,0,122,40,2026-03-30 12:31:52,True
Hacker News,Hacker News,Randomness on Apple Platforms (2024),https://blog.xoria.org/randomness-on-apple-platforms/,0,36,1,2026-03-27 14:41:03,True
Hacker News,Hacker News,Claude Wrote a Full FreeBSD Remote Kernel RCE with Root Shell (CVE-2026-4747),https://github.com/califio/publications/blob/main/MADBugs/CVE-2026-4747/write-up.md,0,203,91,2026-04-01 05:21:48,True
Hacker News,Hacker News,Apple at 50,https://www.apple.com/,0,10,0,2026-04-01 18:48:30,True
Hacker News,Hacker News,Show HN: CLI to order groceries via reverse-engineered REWE API (Haskell),https://github.com/yannick-cw/korb,747,180,78,2026-03-30 06:45:58,True
Hacker News,Hacker News,The Document Foundation ejects its core developers,https://www.collaboraonline.com/blog/tdf-ejects-its-core-developers/,0,69,33,2026-04-01 11:09:11,True
Hacker News,Hacker News,Playing Wolfenstein 3D with one hand in 2026,https://arstechnica.com/gaming/2026/03/playing-wolfenstein-3d-with-one-hand-in-2026/,0,21,8,2026-03-28 13:46:27,True
Hacker News,Hacker News,Claude Code Unpacked : A visual guide,https://ccunpacked.dev/,649,953,346,2026-04-01 05:15:37,True
Hacker News,Hacker News,A dot a day keeps the clutter away,https://scottlawsonbc.com/post/dot-system,0,508,155,2026-03-31 21:15:01,True
Hacker News,Hacker News,Chess in SQL,https://www.dbpro.app/blog/chess-in-pure-sql,0,166,39,2026-03-29 13:25:16,True
Hacker News,Hacker News,"Show HN: 1-Bit Bonsai, the First Commercially Viable 1-Bit LLMs",https://prismml.com/,0,378,143,2026-03-31 21:01:18,True
Hacker News,Hacker News,SpaceX Files to Go Public,https://www.nytimes.com/2026/04/01/technology/spacex-ipo-elon-musk.html,0,19,1,2026-04-01 17:49:54,True
Hacker News,Hacker News,Show HN: Sycamore – next gen Rust web UI library using fine-grained reactivity,https://sycamore.dev,0,89,62,2026-04-01 12:30:18,True
Hacker News,Hacker News,TruffleRuby,https://chrisseaton.com/truffleruby/,0,191,26,2026-03-28 18:39:39,True
Hacker News,Hacker News,TinyLoRA – Learning to Reason in 13 Parameters,https://arxiv.org/abs/2602.04118,0,228,44,2026-03-27 12:11:12,True
Hacker News,Hacker News,New patches allow building Linux IPv6-only,https://www.phoronix.com/news/Linux-IPv6-IPv4-Legacy-Knobs,0,103,128,2026-04-01 13:15:33,True
Hacker News,Hacker News,MiniStack (replacement for LocalStack),https://ministack.org/,0,301,62,2026-03-31 20:48:15,True
Hacker News,Hacker News,Bring Back MiniDV with This Raspberry Pi FireWire Hat,https://www.jeffgeerling.com/blog/2026/minidv-with-raspberry-pi-firewire-hat/,0,115,24,2026-03-28 21:04:06,True
Hacker News,Hacker News,4D Doom,https://github.com/danieldugas/HYPERHELL,0,269,76,2026-03-27 22:19:34,True
Hacker News,Hacker News,CUDA Released in Basic,https://developer.nvidia.com/blog/cuda-tile-programming-now-available-for-basic/,0,21,3,2026-04-01 16:19:49,True
Hacker News,Hacker News,A Letter to John Ternus,https://marco.org/2026/04/01/letter-to-john-ternus,0,9,1,2026-04-01 18:35:46,True
Hacker News,Hacker News,Magic mushroom-infused products appear in Colorado gas stations,https://theconversation.com/magic-mushroom-infused-products-appear-in-colorado-gas-stations-what-public-health-officials-want-consumers-to-know-274935,0,14,0,2026-04-01 16:50:57,True
Hacker News,Hacker News,Axios compromised on NPM – Malicious versions drop remote access trojan,https://www.stepsecurity.io/blog/axios-compromised-on-npm-malicious-versions-drop-remote-access-trojan,0,1900,778,2026-03-31 02:54:17,True
Hacker News,Hacker News,The Finest Swiss Quality Quaternions,https://se3.ch/,0,14,1,2026-04-01 12:58:45,True
Hacker News,Hacker News,US FDA Expected to Lift Restrictions on Dozen Peptides Previously Banned,https://www.nytimes.com/2026/03/31/health/peptide-ban-fda-rfk-jr.html,0,6,3,2026-04-01 18:24:40,True
Hacker News,Hacker News,OpenAI closes funding round at an $852B valuation,https://www.cnbc.com/2026/03/31/openai-funding-round-ipo.html,180,506,470,2026-03-31 20:07:30,True
Hacker News,Hacker News,Teenage Engineering's PO-32 acoustic modem and synth implementation,https://github.com/ericlewis/libpo32,0,138,32,2026-03-28 01:04:56,True
Hacker News,Hacker News,Neanderthals survived on a knife's edge for 350k years,https://www.science.org/content/article/neanderthals-survived-knife-s-edge-350-000-years,0,221,187,2026-04-01 01:12:12,True
Hacker News,Hacker News,Spotify takes on its doppelgänger problem,https://www.platformer.news/spotify-artist-profile-protection/,0,4,0,2026-04-01 18:29:50,True
Hacker News,Hacker News,Ordinary Lab Gloves May Have Skewed Microplastic Data,https://nautil.us/ordinary-lab-gloves-may-have-skewed-microplastic-data-1279386,0,131,51,2026-03-31 21:22:48,True
Hacker News,Hacker News,From 300KB to 69KB per Token: How LLM Architectures Solve the KV Cache Problem,https://news.future-shock.ai/the-weight-of-remembering/,0,150,11,2026-03-28 22:42:23,True
Hacker News,Hacker News,Cohere Transcribe: Speech Recognition,https://cohere.com/blog/transcribe,0,215,69,2026-03-31 16:27:02,True
Hacker News,Hacker News,The Autocrat's Dilemma,https://www.theatlantic.com/international/2026/04/donald-trump-xi-jinping-china-authoritarianism/686631/,0,8,2,2026-04-01 17:26:48,True
Hacker News,Hacker News,Estonia to relaunch Skype as Europe's sovereign platform,https://estonianworld.com/technology/estonia-to-relaunch-skype-as-europes-sovereign-platform/,0,22,7,2026-04-01 15:12:53,True
Hacker News,Hacker News,Show HN: Postgres extension for BM25 relevance-ranked full-text search,https://github.com/timescale/pg_textsearch,2648,187,51,2026-03-31 16:29:52,True
Hacker News,Hacker News,Back to FreeBSD – Part 2 – Jails,https://hypha.pub/back-to-freebsd-part-2,0,111,28,2026-03-27 18:55:02,True
Hacker News,Hacker News,What Is Copilot Exactly?,https://idiallo.com/blog/what-is-copilot-exactly,0,67,45,2026-04-01 16:39:46,True
Hacker News,Hacker News,I traced my traffic through a home Tailscale exit node,https://tech.stonecharioteer.com/posts/2026/tailscale-exit-nodes/,0,137,70,2026-03-31 19:46:43,True
Hacker News,Hacker News,A new way to measure poverty shows the US falling behind Europe,https://www.euronews.com/business/2026/03/29/a-new-way-to-measure-poverty-shows-the-us-falling-behind-europe,0,72,60,2026-04-01 17:02:19,True
Hacker News,Hacker News,Digitizing photos from the 1998 Game Boy Camera,https://swiftrocks.com/digitizing-photos-from-the-1998-game-boy-camera,0,67,15,2026-03-29 11:50:44,True
Hacker News,Hacker News,"Learn Something Old Every Day, Part XVIII: How Does FPU Detection Work?",https://www.os2museum.com/wp/learn-something-old-every-day-part-xviii-how-does-fpu-detection-work/,0,64,6,2026-03-28 16:29:16,True
Hacker News,Hacker News,"In Case of Emergency, Make Burrito Bison 3 (2017)",https://juicybeast.com/2017/08/03/in-case-of-emergency-make-burrito-bison-3/,0,26,8,2026-03-30 14:45:35,True
Hacker News,Hacker News,Replace axios with a simple custom fetch wrapper,https://kentcdodds.com/blog/replace-axios-with-a-simple-custom-fetch-wrapper,0,14,2,2026-04-01 08:32:34,True
Hacker News,Hacker News,Show HN: Forkrun – NUMA-aware shell parallelizer (50×–400× faster than parallel),https://github.com/jkool702/forkrun,2872,142,38,2026-03-27 12:12:20,True
Hacker News,Hacker News,CSS or BS?,https://www.keithcirkel.co.uk/css-or-bs/,0,9,0,2026-04-01 12:46:59,True
Hacker News,Hacker News,Why the US Navy won't blast the Iranians and 'open' Strait of Hormuz,https://responsiblestatecraft.org/iran-strait-of-hormuz/,0,433,1252,2026-03-31 09:30:43,True
Hacker News,Hacker News,Analyzing Geekbench 6 under Intel's BOT,https://www.geekbench.com/blog/2026/03/analyzing-geekbench-6-under-intels-bot/,0,41,15,2026-04-01 03:27:38,True
Hacker News,Hacker News,6o6 v1.1: Faster 6502-on-6502 virtualization for a C64/Apple II Apple-1 emulator,http://oldvcr.blogspot.com/2026/03/6o6-v11-faster-6502-on-6502.html,0,31,1,2026-03-29 02:58:35,True
Hacker News,Hacker News,Ask HN: What dev tools do you rely on that nobody talks about?,https://news.ycombinator.com/item?id=47602040,259,12,7,2026-04-01 15:16:12,False
Hacker News,Hacker News,What major works of literature were written after age of 85? 75? 65?,https://statmodeling.stat.columbia.edu/2026/03/25/what-major-works-of-literature-were-written-after-age-of-85-75-65/,0,142,95,2026-03-28 16:29:28,True
Hacker News,Hacker News,"The Claude Code Source Leak: fake tools, frustration regexes, undercover mode",https://alex000kim.com/posts/2026-03-31-claude-code-source-leak/,365,1324,543,2026-03-31 13:04:30,True
Hacker News,Hacker News,GitHub Monaspace Case Study,https://lettermatic.com/custom/monaspace-case-study,0,142,47,2026-03-31 15:01:35,True
Hacker News,Hacker News,OpenAI demand sinks on secondary market as Anthropic runs hot,https://www.bloomberg.com/news/articles/2026-04-01/openai-demand-sinks-on-secondary-market-as-anthropic-runs-hot,0,123,57,2026-04-01 14:26:16,True
Hacker News,Hacker News,"Iran threatens Nvidia, Apple and other 18 tech companies",https://www.cnbc.com/2026/04/01/iran-irgc-nvidia-appple-attack-threat.html,0,37,20,2026-04-01 12:31:36,True
Hacker News,Hacker News,Combinators,https://tinyapl.rubenverg.com/docs/info/combinators,0,147,40,2026-03-31 11:49:03,True
Hacker News,Hacker News,Google's 200M-parameter time-series foundation model with 16k context,https://github.com/google-research/timesfm,0,309,107,2026-03-31 05:21:59,True
Hacker News,Hacker News,Artemis II is not safe to fly,https://idlewords.com/2026/03/artemis_ii_is_not_safe_to_fly.htm,0,863,596,2026-03-31 02:23:50,True
Hacker News,Hacker News,Slop is not necessarily the future,https://www.greptile.com/blog/ai-slopware-future,0,293,467,2026-03-31 14:32:26,True
Hacker News,Hacker News,Ollama is now powered by MLX on Apple Silicon in preview,https://ollama.com/blog/mlx,0,627,352,2026-03-31 03:40:45,True
Hacker News,Hacker News,"Good CTE, Bad CTE",https://boringsql.com/posts/good-cte-bad-cte/,0,191,43,2026-03-30 07:11:11,True
Hacker News,Hacker News,Ask HN: Client took over development by vibe coding. What to do?,https://news.ycombinator.com/item?id=47599303,2314,44,29,2026-04-01 11:09:03,False
Hacker News,Hacker News,Open source CAD in the browser (Solvespace),https://solvespace.com/webver.pl,0,360,119,2026-03-31 12:50:23,True
Hacker News,Hacker News,GitHub's Historic Uptime,https://damrnelson.github.io/github-historical-uptime/,0,483,120,2026-03-31 19:01:29,True
Hacker News,Hacker News,Show HN: Claude Code rewritten as a bash script,https://github.com/jdcodes1/claude-sh,189,40,12,2026-03-31 23:24:48,True
Hacker News,Hacker News,Remembering Magnetic Memories and the Apollo AGC,https://2earth.github.io/website/20260304.html,0,13,3,2026-04-01 07:22:41,True
Hacker News,Hacker News,Microsoft: Copilot is for entertainment purposes only,https://www.microsoft.com/en-us/microsoft-copilot/for-individuals/termsofuse,0,555,196,2026-03-31 14:25:37,True
Hacker News,Hacker News,Accidentally created my first fork bomb with Claude Code,https://www.droppedasbaby.com/posts/2602-01/,0,75,18,2026-03-31 07:40:18,True
Hacker News,Hacker News,We Built It with Slide Rules. Then We Forgot How,https://unmitigatedrisk.com/?p=1227,0,69,27,2026-04-01 15:50:23,True
Hacker News,Hacker News,Inside the 'self-driving' lab revolution,https://www.nature.com/articles/d41586-026-00974-2,0,59,8,2026-03-30 14:39:43,True
Hacker News,Hacker News,Show HN: Baton – A desktop app for developing with AI agents,https://getbaton.dev/,614,57,47,2026-04-01 12:11:30,True
Hacker News,Hacker News,Claude Code's source code has been leaked via a map file in their NPM registry,https://twitter.com/Fried_rice/status/2038894956459290963,443,2028,1000,2026-03-31 09:00:40,True
Hacker News,Hacker News,Nematophagous Fungus,https://en.wikipedia.org/wiki/Nematophagous_fungus,0,45,10,2026-03-27 13:41:22,True
Hacker News,Hacker News,Claude Code users hitting usage limits 'way faster than expected',https://www.theregister.com/2026/03/31/anthropic_claude_code_limits/,0,315,212,2026-03-31 12:11:29,True
Hacker News,Hacker News,Fedware: Government apps that spy harder than the apps they ban,https://www.sambent.com/the-white-house-app-has-huawei-spyware-and-an-ice-tip-line/,0,673,273,2026-03-30 18:16:00,True
Hacker News,Hacker News,Super Micro Computer Investors Look for Exits,https://catenaa.com/markets/equities/super-micro-computer-investors-look-for-exits/,0,41,23,2026-03-31 19:57:54,True
Hacker News,Hacker News,"GitHub backs down, kills Copilot pull-request ads after backlash",https://www.theregister.com/2026/03/30/github_copilot_ads_pull_requests/,0,593,363,2026-03-31 05:11:24,True
Hacker News,Hacker News,Cherri – programming language that compiles to an Apple Shortuct,https://github.com/electrikmilk/cherri,0,348,73,2026-03-27 23:39:44,True
Hacker News,Hacker News,"""We enabled the availability of iOS 18.7.7 for more devices""",https://support.apple.com/en-us/126793,0,4,0,2026-04-01 19:00:05,True
Hacker News,Hacker News,Vulnerability research is cooked,https://sockpuppet.org/blog/2026/03/30/vulnerability-research-is-cooked/,0,251,167,2026-03-30 18:43:38,True
Hacker News,Hacker News,Ask HN: Distributed data centers in our basements,https://news.ycombinator.com/item?id=47587597,426,70,63,2026-03-31 14:05:42,False
Hacker News,Hacker News,Scotty: A beautiful SSH task runner,https://freek.dev/3064-scotty-a-beautiful-ssh-task-runner,0,62,29,2026-03-31 16:12:29,True
