Source,Original_Platform,Title,URL,SelfText_Length_Chars,Score,Comments,Published_At,Is_Link_Post
Reddit (r/MachineLearning),Reddit,[P] I replaced Dot-Product Attention with distance-based RBF-Attention (so you don't have to...),https://www.reddit.com/r/MachineLearning/comments/1s9cdq0/p_i_replaced_dotproduct_attention_with/,4327,170,27,2026-04-01 06:14:30,False
Reddit (r/MachineLearning),Reddit,[D]  TurboQuant author replies on OpenReview,https://www.reddit.com/r/MachineLearning/comments/1s8yni2/d_turboquant_author_replies_on_openreview/,3592,126,15,2026-03-31 20:11:22,False
Reddit (r/MachineLearning),Reddit,[D] Why I abandoned YOLO for safety critical plant/fungi identification. Closed-set classification is a silent failure mode,https://www.reddit.com/r/MachineLearning/comments/1s9idcm/d_why_i_abandoned_yolo_for_safety_critical/,2147,24,25,2026-04-01 11:54:14,False
Reddit (r/MachineLearning),Reddit,[D] How do ML engineers view vibe coding?,https://www.reddit.com/r/MachineLearning/comments/1s9gu8i/d_how_do_ml_engineers_view_vibe_coding/,970,24,32,2026-04-01 10:36:56,False
Reddit (r/MachineLearning),Reddit,"[R] Gram Newton-Schulz: A Fast, Hardware-Aware Newton-Schulz Algorithm for Muon",https://tridao.me/blog/2026/gram-newton-schulz/,0,17,1,2026-03-31 19:33:31,True
Reddit (r/MachineLearning),Reddit,[P] EVōC: Embedding Vector Oriented Clustering,https://www.reddit.com/r/MachineLearning/comments/1s9js6b/p_evōc_embedding_vector_oriented_clustering/,917,6,1,2026-04-01 12:57:00,False
Reddit (r/MachineLearning),Reddit,[P] Federated Adversarial Learning,https://www.reddit.com/r/MachineLearning/comments/1s9nj3a/p_federated_adversarial_learning/,1815,2,7,2026-04-01 15:18:51,False
Reddit (r/MachineLearning),Reddit,[D] Simple Questions Thread,https://www.reddit.com/r/MachineLearning/comments/1s9n1jr/d_simple_questions_thread/,291,2,0,2026-04-01 15:01:38,False
Reddit (r/MachineLearning),Reddit,[P] I built a simple gpu-aware single-node job scheduler for researchers / students,https://www.reddit.com/gallery/1s9h9gr,1327,2,1,2026-04-01 11:00:02,True
Reddit (r/MachineLearning),Reddit,[R] Literature on optimizing user feedback in the form of Thumbs up/ Thumbs down?,https://www.reddit.com/r/MachineLearning/comments/1s9roar/r_literature_on_optimizing_user_feedback_in_the/,719,1,0,2026-04-01 17:44:13,False
Reddit (r/MachineLearning),Reddit,[D] Does seeing the identify of authors influence your scoring?,https://www.reddit.com/r/MachineLearning/comments/1s9iacl/d_does_seeing_the_identify_of_authors_influence/,516,0,19,2026-04-01 11:50:09,False
Reddit (r/MachineLearning),Reddit,[R] The SPORE Clustering Algorithm,https://www.reddit.com/r/MachineLearning/comments/1s9k5kr/r_the_spore_clustering_algorithm/,5445,0,2,2026-04-01 13:11:31,False
Reddit (r/MachineLearning),Reddit,[R] Pesquisa acadêmica sobre trabalho com microtarefas de machine learning para IA,https://www.reddit.com/r/MachineLearning/comments/1s8xnpq/r_pesquisa_acadêmica_sobre_trabalho_com/,653,0,0,2026-03-31 19:36:33,False
Reddit (r/artificial),Reddit,The Claude Code leak accidentally published the first complete blueprint for production AI agents. Here's what it tells us about where this is all going.,https://www.reddit.com/r/artificial/comments/1s9jprb/the_claude_code_leak_accidentally_published_the/,3263,112,42,2026-04-01 12:54:08,False
Reddit (r/artificial),Reddit,CEO of America’s largest public hospital system says he’s ready to replace radiologists with AI,https://radiologybusiness.com/topics/artificial-intelligence/ceo-americas-largest-public-hospital-system-says-hes-ready-replace-radiologists-ai,0,105,38,2026-04-01 05:19:09,True
Reddit (r/artificial),Reddit,"OkCupid gave 3 million dating-app photos to facial recognition firm, FTC says",https://arstechnica.com/tech-policy/2026/03/okcupid-match-pay-no-fine-for-sharing-user-photos-with-facial-recognition-firm/,0,65,5,2026-04-01 01:34:54,True
Reddit (r/artificial),Reddit,"Paper Finds That Leading AI Chatbots Like ChatGPT and Claude Remain Incredibly Sycophantic, Resulting in Twisted Effects on Users",https://www.reddit.com/r/artificial/comments/1s93wyl/paper_finds_that_leading_ai_chatbots_like_chatgpt/,3225,40,47,2026-03-31 23:35:41,False
Reddit (r/artificial),Reddit,Anthropic is training Claude to recognize when its own tools are trying to manipulate it,https://www.reddit.com/r/artificial/comments/1s9hfhp/anthropic_is_training_claude_to_recognize_when/,1821,19,5,2026-04-01 11:08:05,False
Reddit (r/artificial),Reddit,Biggest Opportunity for Builders to monetise their agents,https://www.reddit.com/r/artificial/comments/1s9e04v/biggest_opportunity_for_builders_to_monetise/,202,6,11,2026-04-01 07:51:34,False
Reddit (r/artificial),Reddit,Which AI do you prefer for video editing?,https://www.reddit.com/r/artificial/comments/1s9b100/which_ai_do_you_prefer_for_video_editing/,313,5,2,2026-04-01 04:59:17,False
Reddit (r/artificial),Reddit,I built a complete vision system for humanoid robots,https://www.reddit.com/r/artificial/comments/1s9kdnq/i_built_a_complete_vision_system_for_humanoid/,1803,3,2,2026-04-01 13:20:02,False
Reddit (r/artificial),Reddit,Agents Can Now Propose and Deploy Their Own Code Changes,https://www.reddit.com/r/artificial/comments/1s9bhug/agents_can_now_propose_and_deploy_their_own_code/,939,2,4,2026-04-01 05:24:19,False
Reddit (r/artificial),Reddit,Combining the robot operating system with LLMs for natural-language control,https://techxplore.com/news/2026-03-combining-robot-llms-natural-language.html,4642,2,0,2026-04-01 16:15:50,True
Reddit (r/artificial),Reddit,A IA parece melhor porque é mais inteligente… ou porque ela não tem ego?,https://www.reddit.com/r/artificial/comments/1s96trg/a_ia_parece_melhor_porque_é_mais_inteligente_ou/,236,3,9,2026-04-01 01:41:15,False
Reddit (r/artificial),Reddit,"Is the Mirage Effect a bug, or is it Geometric Reconstruction in action?
A framework for why VLMs perform better ""hallucinating"" than guessing, and what that may tell us about what's really inside these models",https://www.reddit.com/r/artificial/comments/1s91dsr/is_the_mirage_effect_a_bug_or_is_it_geometric/,9570,2,1,2026-03-31 21:52:53,False
Reddit (r/artificial),Reddit,AI model can detect multiple cognitive brain diseases from a single blood sample,https://medicalxpress.com/news/2026-03-ai-multiple-cognitive-brain-diseases.html,3678,1,0,2026-04-01 16:32:13,True
Reddit (r/artificial),Reddit,Diffusion-based AI model successfully trained in electroplating,https://techxplore.com/news/2026-04-diffusion-based-ai-successfully-electroplating.html,1583,1,1,2026-04-01 16:26:43,True
Reddit (r/artificial),Reddit,I wore Meta’s smartglasses for a month – and it left me feeling like a creep | AI (artificial intelligence) | The Guardian,https://www.theguardian.com/technology/2026/apr/01/i-wore-metas-smartglasses-for-a-month-and-it-left-me-feeling-like-a-creep,0,0,0,2026-04-01 06:08:12,True
Reddit (r/artificial),Reddit,The missing layer between current AI and AGI may be intent architecture,https://www.reddit.com/r/artificial/comments/1s98x0b/the_missing_layer_between_current_ai_and_agi_may/,3959,0,7,2026-04-01 03:14:19,False
Reddit (r/artificial),Reddit,Which LLM is the best for writing a scientific paper?,https://www.reddit.com/r/artificial/comments/1s9k2rx/which_llm_is_the_best_for_writing_a_scientific/,450,0,6,2026-04-01 13:08:33,False
Reddit (r/artificial),Reddit,LLM agents can trigger real actions now. But what actually stops them from executing?,https://www.reddit.com/r/artificial/comments/1s955un/llm_agents_can_trigger_real_actions_now_but_what/,1482,0,3,2026-04-01 00:27:45,False
Reddit (r/technology),Reddit,CEO of America’s largest public hospital system says he’s ready to replace radiologists with AI,https://radiologybusiness.com/topics/artificial-intelligence/ceo-americas-largest-public-hospital-system-says-hes-ready-replace-radiologists-ai,0,14621,1679,2026-03-31 23:41:00,True
Reddit (r/technology),Reddit,US patent office revokes Nintendo’s patent on summoning characters to make them battle | VGC,https://www.videogameschronicle.com/news/us-patent-office-revokes-nintendos-patent-on-summoning-characters-to-make-them-battle/,0,12933,563,2026-04-01 13:11:32,True
Reddit (r/technology),Reddit,"Gabe Newell ""stepped back"" from making games at Valve after Portal 2 because everyone kept agreeing with him when he wanted ""to be part of the team and come up with ideas""",https://www.gamesradar.com/games/gabe-newell-stepped-back-from-making-games-at-valve-after-portal-2-because-everyone-kept-agreeing-with-him-when-he-wanted-to-be-part-of-the-team-and-come-up-with-ideas/,0,8059,497,2026-04-01 14:58:08,True
Reddit (r/technology),Reddit,Another Starlink satellite has inexplicably exploded,https://www.theverge.com/science/903906/another-starlink-satellite-has-inexplicably-exploded,0,7477,733,2026-04-01 01:00:44,True
Reddit (r/technology),Reddit,"Anthropic issues copyright takedown requests to remove 8,000+ copies of Claude Code source code",https://www.wsj.com/tech/ai/anthropic-races-to-contain-leak-of-code-behind-claude-ai-agent-4bc5acc7?st=BQwoMN&amp;reflink=desktopwebshare_permalink,0,7462,573,2026-04-01 12:48:59,True
Reddit (r/technology),Reddit,"OkCupid gave 3 million dating-app photos to facial recognition firm, FTC says",https://arstechnica.com/tech-policy/2026/03/okcupid-match-pay-no-fine-for-sharing-user-photos-with-facial-recognition-firm/,0,5402,143,2026-03-31 19:24:27,True
Reddit (r/technology),Reddit,"Microsoft closes worst quarter on Wall Street since 2008 on AI concerns / Microsoft lost almost a quarter of its value in the first three months of the year, its steepest quarterly drop since the 2008 financial crisis.",https://www.cnbc.com/2026/03/31/microsofts-stock-closes-worst-quarter-since-2008-financial-crisis.html,0,4797,392,2026-03-31 20:27:05,True
Reddit (r/technology),Reddit,"Entire Claude Code CLI source code leaks thanks to exposed map file | 512,000 lines of code that competitors and hobbyists will be studying for weeks.",https://arstechnica.com/ai/2026/03/entire-claude-code-cli-source-code-leaks-thanks-to-exposed-map-file/,0,4265,205,2026-03-31 19:29:37,True
Reddit (r/technology),Reddit,A million new SpaceX satellites will destroy the night sky — for everyone on Earth,https://theconversation.com/a-million-new-spacex-satellites-will-destroy-the-night-sky-for-everyone-on-earth-277938,0,3659,387,2026-04-01 06:17:33,True
Reddit (r/technology),Reddit,"Oracle is cutting up to 30,000 employees to pay for AI data centres",https://thenextweb.com/news/oracle-layoffs-march-2026,0,2745,260,2026-03-31 22:58:43,True
Reddit (r/technology),Reddit,Starlink satellite breaks apart into “tens of objects”; SpaceX confirms “anomaly”,https://arstechnica.com/tech-policy/2026/03/starlink-satellite-breaks-apart-into-tens-of-objects-spacex-confirms-anomaly/,0,1556,211,2026-03-31 22:00:30,True
Reddit (r/technology),Reddit,Anthropic accidentally exposes Claude Code source code,https://www.theregister.com/2026/03/31/anthropic_claude_code_source_code,0,1144,58,2026-04-01 01:13:36,True
Reddit (r/technology),Reddit,Apple Removes iPhone Vibe Coding App from App Store,https://gizmodo.com/apple-removes-iphone-vibe-coding-app-from-app-store-2000740084,0,986,66,2026-04-01 11:43:51,True
Reddit (r/technology),Reddit,OpenAI Valued at $852 Billion After Completing $122 Billion Round,https://www.bloomberg.com/news/articles/2026-03-31/openai-valued-at-852-billion-after-completing-122-billion-round,0,896,243,2026-03-31 20:50:46,True
Reddit (r/technology),Reddit,Kathleen Kennedy Just Told an AI Conference She’s Not So Sure About AI,https://www.hollywoodreporter.com/business/digital/kathleen-kennedy-star-wars-ai-runway-think-1236553421/,0,771,73,2026-04-01 14:25:25,True
Reddit (r/technology),Reddit,Iran Threatens to Start Attacking Major US Tech Firms on April 1,https://www.wired.com/story/iran-threatens-to-start-attacking-major-us-tech-firms-on-april-1/,0,767,131,2026-04-01 02:22:20,True
Reddit (r/technology),Reddit,Iran War Chokes Off Helium Supply Critical for AI,https://www.wsj.com/world/iran-war-chokes-off-helium-supply-critical-for-ai-bf020a3f,0,744,105,2026-04-01 16:10:26,True
Reddit (r/technology),Reddit,Penguin to sue OpenAI over ChatGPT version of German children’s book,https://www.theguardian.com/technology/2026/mar/31/penguin-sue-openai-chatgpt-german-childrens-book-kokosnuss,0,658,51,2026-04-01 12:22:16,True
Reddit (r/technology),Reddit,"If You Need a Laptop, Buy It Now: Electronics are getting more expensive and worse. Blame the AI boom.",https://www.theatlantic.com/technology/2026/03/laptop-electronics-ram-ai-tax/686628/,0,589,111,2026-03-31 21:25:04,True
Reddit (r/technology),Reddit,"First Western Digital, now Sony: The tech giant suspends SD card sales",https://mashable.com/article/sony-sd-card-sales-suspended-memory-shortage,0,335,41,2026-04-01 09:17:24,True
Reddit (r/technology),Reddit,"Kids groups say they didn’t know OpenAI was behind their child safety coalition.
“A very grimy feeling”: The ChatGPT giant quietly helped build the coalition. Some members quit when they found out.",https://sfstandard.com/2026/04/01/openai-ai-kids-safety-coalition/,0,292,15,2026-04-01 17:22:41,True
Reddit (r/technology),Reddit,Quantum Computing Built An Impossible Molecule — With Big Implications,https://www.forbes.com/sites/moorinsights/2026/03/30/quantum-computing-built-an-impossible-molecule---with-big-implications/,0,243,94,2026-04-01 08:55:40,True
Reddit (r/technology),Reddit,43 hours battery life: Dell XPS 14 2026 lasts almost 3x longer vs MacBook Air 15 M5 in web browsing test,https://www.notebookcheck.net/43-hours-battery-life-Dell-XPS-14-2026-lasts-almost-3x-longer-vs-MacBook-Air-15-M5-in-web-browsing-test.1262947.0.html,0,144,108,2026-03-31 19:35:27,True
Reddit (r/technology),Reddit,"ONLYOFFICE Gets Forked as ""Made in Europe"", Sparks Licensing and Trust Debate",https://itsfoss.com/news/onlyoffice-forked/,0,129,39,2026-04-01 10:50:08,True
Reddit (r/technology),Reddit,Oracle cuts thousands of jobs as it steps up AI spending,https://www.theguardian.com/technology/2026/apr/01/us-tech-firm-oracle-cuts-thousands-of-jobs-as-it-steps-up-ai-spending-larry-ellison,0,127,23,2026-04-01 12:08:46,True
Reddit (r/technology),Reddit,Renewables grew to almost 50% of global electricity capacity in 2025 after solar boost,https://www.reuters.com/business/energy/renewables-grew-almost-50-global-electricity-capacity-2025-after-solar-boost-2026-03-31/,0,106,5,2026-04-01 11:47:55,True
Reddit (r/technology),Reddit,Will the Iran war pop the AI bubble? | The Week,https://theweek.com/world-news/iran-war-ai-artificial-intelligence-bubble-collapse,0,104,41,2026-04-01 02:28:25,True
Reddit (r/technology),Reddit,"Iran threatens Nvidia, Apple and other tech giants with attack",https://www.cnbcafrica.com/2026/iran-threatens-nvidia-apple-and-other-tech-giants-with-attack,0,99,27,2026-04-01 13:04:18,True
Reddit (r/technology),Reddit,AT&amp;T signs deal worth $2 billion to upgrade emergency cellular network,https://finance.yahoo.com/sectors/technology/articles/t-signs-deal-worth-2-214628742.html,0,93,19,2026-03-31 23:59:24,True
Reddit (r/technology),Reddit,"Judge blocks U.S President's termination of parole for migrants who legally entered U.S. using Biden-era app | More than 900,000 people legally entered the U.S. through the CBP One application, which scheduled appointments for migrants at ports of entry beginning in January 2023.",https://www.nbcnews.com/news/us-news/judge-blocks-trump-termination-parole-migrants-legally-entered-us-usin-rcna266078,0,84,3,2026-04-01 16:56:31,True
Reddit (r/technology),Reddit,"After Intel, AMD is now also raising CPU prices by up to 15%",https://www.tweaktown.com/news/110699/after-intel-amd-is-now-also-raising-cpu-prices-by-up-to-15-percent/index.html,0,79,16,2026-04-01 06:35:52,True
Reddit (r/technology),Reddit,Microsoft is modernizing Windows 11's aging UI and shifting to native apps,https://www.pcworld.com/article/3103257/microsoft-is-modernizing-windows-11s-aging-ui-shifting-to-native-apps.html,0,80,79,2026-03-31 21:50:53,True
Reddit (r/technology),Reddit,Robotaxi companies refuse to say how often their AVs need remote help,https://techcrunch.com/2026/03/31/robotaxi-companies-refuse-to-say-how-often-their-avs-need-remote-help/,0,74,28,2026-04-01 00:44:42,True
Reddit (r/technology),Reddit,"Amazon's cloud business in Bahrain damaged in Iran strike, FT reports",https://www.reuters.com/world/middle-east/amazons-cloud-business-bahrain-damaged-iran-strike-ft-reports-2026-04-01/,0,56,7,2026-04-01 17:42:49,True
Reddit (r/technology),Reddit,"Caltech Team Finds Useful Quantum Computers Could Be Built with as Few as 10,000 Qubits.",https://www.caltech.edu/about/news/caltech-team-finds-useful-quantum-computers-could-be-built-with-as-few-as-10000-qubits,0,44,8,2026-03-31 23:18:12,True
Reddit (r/technology),Reddit,TSMC plans 3-nanometre chip production launch in Japan in 2028,https://www.reuters.com/business/autos-transportation/tsmc-plans-3-nanometre-chip-production-launch-japan-2028-2026-04-01/,0,44,0,2026-04-01 11:06:56,True
Reddit (r/technology),Reddit,Stanford scientists create shape-shifting material that changes color and texture like an octopus,https://www.sciencedaily.com/releases/2026/03/260330001140.htm,0,42,3,2026-04-01 02:38:11,True
Reddit (r/technology),Reddit,AT&amp;T signs deal worth $2 billion to upgrade emergency cellular network,https://www.reuters.com/business/media-telecom/att-signs-deal-worth-2-billion-upgrade-emergency-cellular-network-2026-03-31/,0,38,9,2026-04-01 10:21:04,True
Reddit (r/technology),Reddit,Anthropic Races to Contain Leak of Code Behind Claude AI Agent,https://www.wsj.com/tech/ai/anthropic-races-to-contain-leak-of-code-behind-claude-ai-agent-4bc5acc7,0,35,1,2026-04-01 13:35:18,True
Reddit (r/technology),Reddit,North Korea-linked hack hits largely invisible software that powers online services,https://www.reuters.com/sustainability/boards-policy-regulation/north-korea-linked-hack-hits-largely-invisible-software-that-powers-online-2026-03-31/,0,29,0,2026-04-01 10:16:00,True
Reddit (r/technology),Reddit,Robotaxi outage in China leaves passengers stranded on highways,https://www.wired.com/story/robotaxi-outage-in-china-leaves-passengers-stuck-in-cars-on-highways/,0,24,2,2026-04-01 05:06:52,True
Reddit (r/technology),Reddit,"One operator, multiple drones: Ukraine tests advanced interceptor swarm technology",https://newsukraine.rbc.ua/news/one-operator-multiple-drones-ukraine-tests-1775021429.html,0,23,0,2026-04-01 12:43:05,True
Reddit (r/technology),Reddit,Sony and TCL Sign Definitive Agreements for Strategic Partnership in the Home Entertainment Field,https://www.sony.co.jp/en/news-release/202603/26-0331E/,0,20,7,2026-04-01 03:31:22,True
Reddit (r/technology),Reddit,Baidu's Apollo Go self-driving cars stop mid-traffic in China,https://www.bbc.co.uk/news/articles/cvge91r9j80o,0,19,1,2026-04-01 12:00:26,True
Reddit (r/technology),Reddit,"Microsoft on track to invest $5.5 billion in Singapore by 2029, WSJ reports",https://www.reuters.com/world/asia-pacific/microsoft-track-invest-55-billion-singapore-by-2029-wsj-reports-2026-04-01/,0,17,1,2026-04-01 08:20:51,True
Reddit (r/technology),Reddit,Renewable energy capacity in record rise last year with war set to increase focus on sector,https://www.thenationalnews.com/business/energy/2026/04/01/renewable-energy-capacity-in-record-rise-last-year-with-war-set-to-increase-focus-on-sector/,0,16,2,2026-04-01 17:38:52,True
Reddit (r/technology),Reddit,"DRAM prices predicted to jump 63% in Q2, NAND up to 75% — follows 95% jumps in Q1, Trendforce says AI server demand keeps supply tight",https://www.tomshardware.com/pc-components/dram/dram-and-nand-contract-prices-to-climb-again-in-q2,0,13,8,2026-04-01 17:55:51,True
Reddit (r/technology),Reddit,Running local models on Macs gets faster with Ollama's MLX support | Apple Silicon Macs get a performance boost thanks to better unified memory usage.,https://arstechnica.com/apple/2026/03/running-local-models-on-macs-gets-faster-with-ollamas-mlx-support/,0,15,2,2026-04-01 03:42:30,True
Reddit (r/technology),Reddit,"As Apple turns 50, we look back at the boldest (and most questionable) hardware to ever pass through the PC Labs.",https://www.pcmag.com/articles/apple-50-hits-misses-from-the-pages-of-pc-magazine,0,8,7,2026-04-01 13:40:38,True
Reddit (r/technology),Reddit,Intel to buy back Apollo stake in Ireland factory for $14.2 billion,https://www.reuters.com/world/europe/intel-buy-back-apollo-stake-ireland-factory-142-billion-2026-04-01/,0,8,0,2026-04-01 13:10:47,True
Reddit (r/LocalLLaMA),Reddit,Llama.cpp developers right now,https://i.redd.it/qvni8jzkajsg1.jpeg,113,648,92,2026-04-01 07:48:12,True
Reddit (r/LocalLLaMA),Reddit,Claude Code's source just leaked — I extracted its multi-agent orchestration system into an open-source framework that works with any LLM,https://www.reddit.com/r/LocalLLaMA/comments/1s8xj2e/claude_codes_source_just_leaked_i_extracted_its/,1388,574,235,2026-03-31 19:32:02,False
Reddit (r/LocalLLaMA),Reddit,"TurboQuant isn’t just for KV: Qwen3.5-27B at near-Q4_0 quality, about 10% smaller, and finally fitting on my 16GB 5060 Ti",https://i.redd.it/118nngfciksg1.png,2977,409,103,2026-04-01 11:58:02,True
Reddit (r/LocalLLaMA),Reddit,"FOR ME, Qwen3.5-27B is better than Gemini 3.1 Pro and GPT-5.3 Codex",https://www.reddit.com/r/LocalLLaMA/comments/1s93n1j/for_me_qwen3527b_is_better_than_gemini_31_pro_and/,2319,325,163,2026-03-31 23:23:55,False
Reddit (r/LocalLLaMA),Reddit,PrismML — Announcing 1-bit Bonsai: The First Commercially Viable 1-bit LLMs,https://prismml.com/news/bonsai-8b,0,278,128,2026-03-31 21:34:29,True
Reddit (r/LocalLLaMA),Reddit,The source code to Aider has just leaked after being committed to github,https://github.com/Aider-AI/aider,0,146,11,2026-04-01 15:39:01,True
Reddit (r/LocalLLaMA),Reddit,Falcon-OCR and Falcon-Perception,https://v.redd.it/i9vlaiol9ksg1,388,109,17,2026-04-01 11:05:58,True
Reddit (r/LocalLLaMA),Reddit,llama : rotate activations for better quantization by ggerganov · Pull Request #21038 · ggml-org/llama.cpp,https://github.com/ggml-org/llama.cpp/pull/21038,48,99,32,2026-04-01 14:01:52,True
Reddit (r/LocalLLaMA),Reddit,Does the Claude “leak” actually change anything in practice?,https://www.reddit.com/r/LocalLLaMA/comments/1s9gol0/does_the_claude_leak_actually_change_anything_in/,347,87,87,2026-04-01 10:28:42,False
Reddit (r/LocalLLaMA),Reddit,New build,https://i.redd.it/6gcwubqi5hsg1.jpeg,422,80,32,2026-04-01 00:36:10,True
Reddit (r/LocalLLaMA),Reddit,arcee-ai/Trinity-Large-Thinking · Hugging Face,https://i.redd.it/k8o0rrfoulsg1.png,104,75,27,2026-04-01 16:24:31,True
Reddit (r/LocalLLaMA),Reddit,attn-rot (TurboQuant-like KV cache trick) lands in llama.cpp,https://github.com/ggml-org/llama.cpp/pull/21038#issue-4146294463,66,76,11,2026-04-01 15:27:20,True
Reddit (r/LocalLLaMA),Reddit,"You guys seen this? 1-bit model with an MMLU-R of 65.7, 8B params",https://www.reddit.com/r/LocalLLaMA/comments/1s91jxl/you_guys_seen_this_1bit_model_with_an_mmlur_of/,134,70,35,2026-03-31 21:59:42,False
Reddit (r/LocalLLaMA),Reddit,"A Reminder, Guys, Undervolt your GPUs Immediately. You will Significantly Decrease Wattage without Hitting Performance.",https://www.reddit.com/r/LocalLLaMA/comments/1s9i1gn/a_reminder_guys_undervolt_your_gpus_immediately/,840,70,46,2026-04-01 11:38:21,False
Reddit (r/LocalLLaMA),Reddit,Anyone else notice qwen 3.5 is a lying little shit,https://www.reddit.com/r/LocalLLaMA/comments/1s9kf23/anyone_else_notice_qwen_35_is_a_lying_little_shit/,455,65,58,2026-04-01 13:21:30,False
Reddit (r/LocalLLaMA),Reddit,1-bit llms on device?!,https://www.reddit.com/r/LocalLLaMA/comments/1s951bw/1bit_llms_on_device/,889,63,29,2026-04-01 00:22:14,False
Reddit (r/LocalLLaMA),Reddit,GLM 5.1 vs Minimax 2.7,https://www.reddit.com/r/LocalLLaMA/comments/1s8zmbc/glm_51_vs_minimax_27/,2156,46,37,2026-03-31 20:46:26,False
Reddit (r/LocalLLaMA),Reddit,"Found references to ""models/gemma-4"" hiding in AI Studio's code. Release imminent? 👀",https://www.reddit.com/r/LocalLLaMA/comments/1s9csov/found_references_to_modelsgemma4_hiding_in_ai/,842,42,10,2026-04-01 06:39:18,False
Reddit (r/LocalLLaMA),Reddit,Raspberry Pi5 LLM performance,https://www.reddit.com/r/LocalLLaMA/comments/1s8xuew/raspberry_pi5_llm_performance/,4467,33,26,2026-03-31 19:43:00,False
Reddit (r/LocalLLaMA),Reddit,16x AMD MI50 32GB at 32 t/s (tg) &amp; 2k t/s (pp) with Qwen3.5 397B (vllm-gfx906-mobydick),https://www.reddit.com/r/LocalLLaMA/comments/1s9ivgl/16x_amd_mi50_32gb_at_32_ts_tg_2k_ts_pp_with/,2553,27,36,2026-04-01 12:17:04,False
Reddit (r/LocalLLaMA),Reddit,How do we actually guarantee sandbox isolation when local LLMs have tool access?,https://www.reddit.com/r/LocalLLaMA/comments/1s9apij/how_do_we_actually_guarantee_sandbox_isolation/,1010,23,17,2026-04-01 04:42:15,False
Reddit (r/LocalLLaMA),Reddit,"""The Child That Surpassed Both Parents"" Darwin-35B-A3B-Opus (35B/3B MoE) with Model MRI Technique",https://www.reddit.com/r/LocalLLaMA/comments/1s9irdk/the_child_that_surpassed_both_parents/,1179,20,18,2026-04-01 12:12:03,False
Reddit (r/LocalLLaMA),Reddit,I think we should have sticky post about security and risks and safe practices as agentic become more prominent.,https://www.reddit.com/r/LocalLLaMA/comments/1s9b585/i_think_we_should_have_sticky_post_about_security/,638,20,18,2026-04-01 05:05:07,False
Reddit (r/LocalLLaMA),Reddit,Benchmarked 18 models that I can run on my RTX 5080 16GB using Nick Lothian's SQL benchmark,https://www.reddit.com/r/LocalLLaMA/comments/1s9mkm1/benchmarked_18_models_that_i_can_run_on_my_rtx/,2823,19,16,2026-04-01 14:44:28,False
